{
    "$schema": "_globalSchema.json",
    "prefix": "better-moodle",
    "userscript": { "coreAuthors": ["Jan (jxn_30)", "Yorik (YorikHansen)"] },
    "featureGroupOrder": [
        "darkmode",
        "dashboard",
        "courses",
        "messages",
        "navbarMarquee",
        "linkIcons",
        "speiseplan",
        "semesterzeiten",
        "bookmarks",
        "weather",
        "nina"
    ],
    "defaultDisabled": [
        "general.cauNavbar",
        "general.hsnrNavbar",
        "semesterzeiten",
        "speiseplan"
    ],
    "enabledFrom": { "405": ["courses.sectionCourseIndex"] },
    "disabledFrom": { "402": ["courses.courseIndexDrawerControls"] },
    "connects": {
        "": [
            "better-moodle.dev",
            "github.com",
            "release-assets.githubusercontent.com"
        ],
        "nina": ["warnung.bund.de"],
        "weather": [
            "api.open-meteo.com",
            "api.openweathermap.org",
            "weather.visualcrossing.com",
            "wttr.in"
        ]
    }
}
